{"canonicalization":"rs-canonical-json-v1","counts":{"failed":0,"passed":1,"skipped":0,"total":1},"entry_id":"standalone.filesystem-curl","kind":"Executable","reason_codes":[],"schema":"red-salamander.validation-terminal-result.v1","status":"PASSED","terminal_result_digest":"a03444f6357a94be2b5ce354c118dd283efeb9a826cf1cd52d2f7a275b55f2fa"}
